{"accompanyingActions":{"credentialPublication":false,"deployment":false,"gateOrFinalAccess":false,"promotion":false,"providerCall":false,"researchExecution":false},"attestation":{"algorithm":"Ed25519","keyId":"protocol.author.publication-governance.2026-07-31.ed25519","signature":"jbSZoW4Bsa5_ca2dj4xuhoW5oD_ktH44LS0bV93t-vDr1n0giD5-w2XrVlCbHTuIMvAJuWREUg1eQSzFFY47Bg"},"deviationId":"publication-deviation.github-development.2026-07-31","dispositionDecision":{"decision":"REVISE","responsePath":".codex/gpt-pro-architect/responses/response-3rrrr.md","responseSha256":"sha256:deab2175380d472a8581ab4baed07af8518fde3ffa0a90a6457bb03a234db9cf","round":"03RRRR"},"evidenceCheckpoint":{"commit":"a5d82564cece5ecb776a27c86512c3ec56f32787","tree":"1bbc1a7623460cf52907758e7ee93149e18a0aec"},"exceededAuthorization":"The user explicitly instructed periodic pushes to the new GitHub repository, but the Round 03RRR Architect authorization prohibited repository push/publication. The three origin/main updates therefore exceeded the narrower Architect authorization and permanently exposed the development artifacts.","governanceDomainId":"self-evolving-harness.publication-governance","implementationSource":{"commit":"88e39cdebf1df4db7688fff592363f5f867533ce","tree":"ccb20381cc3308cb71954789614144575870eb83"},"inventory":{"entryCount":510,"inventoryHash":"sha256:1765dbf575a1997b9e2915c3e1cbbd7118135fd76dff02df28765bc8561decb6","inventoryId":"published-inventory.origin-main.a5d8256","path":"governance/public-exposure/inventory-a5d8256.json","snapshotCommit":"a5d82564cece5ecb776a27c86512c3ec56f32787","snapshotTree":"1bbc1a7623460cf52907758e7ee93149e18a0aec"},"permanentConsequence":{"historyRewriteDoesNotRestoreSecrecy":true,"publicExposureIrreversible":true,"publishedArtifactsRequireExposureLedger":true,"repositoryDeletionDoesNotRestoreSecrecy":true},"priorDecision":{"decision":"APPROVE","responsePath":".codex/gpt-pro-architect/responses/response-3rrr.md","responseSha256":"sha256:ac0637a0c8a17ff77c9db732ed4b2632acc825526f7b632c8ff57d89074370e3","round":"03RRR"},"publicPrincipal":{"identity":{"identityDigest":"sha256:287a417463f1316f7df1077e45b9b31c8fb98770214984fb93c6f39299bc4732","implementationDigest":"sha256:2dc3e69618c55e48e4072f437e45881619dbdb7228e10f3ef593dcfbe6a36e82","instanceId":"protocol.author.publication-governance.2026-07-31.instance","principalId":"protocol.author.publication-governance.2026-07-31","role":"protocol_author"},"keyId":"protocol.author.publication-governance.2026-07-31.ed25519","publicKeyPem":"-----BEGIN PUBLIC KEY-----\nMCowBQYDK2VwAyEAcrHuc7x+o3+erXCismxUTAdj9BWeG03OcNs+HncNhAI=\n-----END PUBLIC KEY-----\n"},"publishedRefs":[{"commit":"c041f7405790e9ff85af621b468b547adbfa4987","observationSource":"local_remote_tracking_reflog","publishedAt":"2026-07-31T15:16:46+09:00","refName":"refs/heads/main","tree":"2911cf9e6d51561dab6541a98a0697d8015a3cc8"},{"commit":"88e39cdebf1df4db7688fff592363f5f867533ce","observationSource":"local_remote_tracking_reflog","publishedAt":"2026-07-31T15:22:04+09:00","refName":"refs/heads/main","tree":"ccb20381cc3308cb71954789614144575870eb83"},{"commit":"a5d82564cece5ecb776a27c86512c3ec56f32787","observationSource":"local_remote_tracking_reflog","publishedAt":"2026-07-31T15:31:50+09:00","refName":"refs/heads/main","tree":"1bbc1a7623460cf52907758e7ee93149e18a0aec"}],"recordHash":"sha256:86a013e41c99fb1cf60e2d6377105ce88931c6f1416f829d791b5f76673eef4b","recordType":"publication_deviation","recordedAt":"2026-07-31T16:01:00+09:00","recordedBy":{"identityDigest":"sha256:287a417463f1316f7df1077e45b9b31c8fb98770214984fb93c6f39299bc4732","implementationDigest":"sha256:2dc3e69618c55e48e4072f437e45881619dbdb7228e10f3ef593dcfbe6a36e82","instanceId":"protocol.author.publication-governance.2026-07-31.instance","principalId":"protocol.author.publication-governance.2026-07-31","role":"protocol_author"},"remediation":{"requiredActions":["Bind every published Git blob and embedded development identifier into a signed public-exposure ledger.","Deny direct and transitive use in held-out, sealed, temporal holdout, gate, final, confirmatory, research-selection, promotion, research-evidence, and claim-table lifecycles.","Preserve the deviation record and append a separately signed remediation closure.","Verify the complete snapshot, secret scan, signatures, hashes, and anti-laundering policy from a clean corrective commit."],"status":"in_progress"},"repository":{"branch":"main","owner":"dsa04156","remoteName":"origin","url":"https://github.com/dsa04156/self-evolving-harness"},"schemaVersion":1,"secretScan":{"environmentFilesFound":0,"falsePositiveLiterals":["sk-validation-mode-must-ignore-this"],"patterns":["private key PEM","OpenAI-style live key","GitHub personal access token","AWS access key"],"privateKeysPublished":false,"result":"no_actual_secret_match","scannedScopes":["Git snapshot a5d82564cece5ecb776a27c86512c3ec56f32787","510 tracked files","501 unique Git blobs"]},"userAuthorization":{"instructionSha256":"sha256:dddd269acc1ee4151fc3a57432b970d22a6a36a041f822ef98c92166c0339596","instructionText":"https://github.com/dsa04156/self-evolving-harness 이거ㅣ 새로만들었는데 업데이트 중간중간 하면서 진행해","source":"conversation_user_message","timestampAvailability":"not_recorded"}}
